{"$schema":"http://json-schema.org/draft-07/schema#","$id":"https://tomasz-talik-cv.local/schemas/profile.schema.json","type":"object","required":["profileId","sectionOrder","visibleSections"],"properties":{"profileId":{"$ref":"common.schema.json#/definitions/profileId"},"company":{"$ref":"common.schema.json#/definitions/localizedText"},"targetRole":{"$ref":"common.schema.json#/definitions/localizedText"},"headline":{"$ref":"common.schema.json#/definitions/localizedText"},"companyMessage":{"$ref":"common.schema.json#/definitions/localizedText"},"accent":{"type":"string","pattern":"^[a-z0-9]+(?:-[a-z0-9]+)*$"},"sectionOrder":{"type":"array","items":{"type":"string"},"uniqueItems":true},"visibleSections":{"type":"array","items":{"type":"string"},"uniqueItems":true},"projectOrder":{"type":"array","items":{"$ref":"common.schema.json#/definitions/stableId"},"uniqueItems":true},"featuredProjectIds":{"type":"array","items":{"$ref":"common.schema.json#/definitions/stableId"},"uniqueItems":true},"skillOrder":{"type":"array","items":{"$ref":"common.schema.json#/definitions/stableId"},"uniqueItems":true},"featuredSkillIds":{"type":"array","items":{"$ref":"common.schema.json#/definitions/stableId"},"uniqueItems":true},"pdf":{"$ref":"common.schema.json#/definitions/assetPath"},"protectedScopes":{"type":"array","items":{"type":"string","pattern":"^[a-z][a-z0-9-]*$"},"uniqueItems":true}},"additionalProperties":false}
